"Bauer T., Kourouxous T.","57189993268;57189994318;","Capital Charge Rates, Investment Incentives and Taxation",2017,"European Accounting Review","26","3",,"419","440",,1,"10.1080/09638180.2016.1169938","https://www.scopus.com/inward/record.uri?eid=2-s2.0-84976315918&doi=10.1080%2f09638180.2016.1169938&partnerID=40&md5=3574906a03fe259c21279ba0b86d4f8e","Department of Business Administration, University of Vienna, Vienna, Austria","Bauer, T., Department of Business Administration, University of Vienna, Vienna, Austria; Kourouxous, T., Department of Business Administration, University of Vienna, Vienna, Austria","This paper studies the impact of personal and corporate income taxation on capital charge rates in a delegation setting with a risk-averse manager. If the investment level influences the riskiness of the investment project, the capital charge rate deviates from the firm's cost of capital and depends crucially on the manager's personal income tax rate. Contradicting conventional wisdom, we find that a higher personal income tax rate induces higher investment expenditures and, surprisingly, increases the capital charge rate. The countervailing effect that a higher capital charge rate induces higher and not lower investment expenditures persists for pre-tax and after-tax performance measures as well as when the tax deductibility of managerial compensation is limited. Corporate income tax causes a similar effect only in the case of limited tax deductibility of compensation. Our insights remain valid regardless of the financing structure and the risk attitude of the investors. © 2016 European Accounting Association.",,,"Bauer, T.; Department of Business Administration, Oskar- Morgenstern-Platz 1, Austria; email: thom.bauer@univie.ac.at",,"Routledge",09638180,,,,"English","Eur. Acc. Rev.",Article,"Final","",Scopus,2-s2.0-84976315918
"Hasan M.M., Al-Hadi A., Taylor G., Richardson G.","56489515600;6506840920;36125472400;14825601700;","Does a Firm’s Life Cycle Explain Its Propensity to Engage in Corporate Tax Avoidance?",2017,"European Accounting Review","26","3",,"469","501",,19,"10.1080/09638180.2016.1194220","https://www.scopus.com/inward/record.uri?eid=2-s2.0-84976287687&doi=10.1080%2f09638180.2016.1194220&partnerID=40&md5=ce5fa7f39889e72978181d7c06f84172","School of Economics and Finance, Curtin Business School, Curtin University, GPO Box U1987, Perth, 6845, Australia; School of Accounting, Curtin Business School, Curtin University, GPO Box U1987, Perth, 6845, Australia; College of Applied Science–Nizwa, P.O. Box 699, Nizwa, 611, Oman; School of Accounting and Finance, The Business School, The University of Adelaide, 10 Pulteney Street, Adelaide, 5005, Australia","Hasan, M.M., School of Economics and Finance, Curtin Business School, Curtin University, GPO Box U1987, Perth, 6845, Australia; Al-Hadi, A., School of Accounting, Curtin Business School, Curtin University, GPO Box U1987, Perth, 6845, Australia, College of Applied Science–Nizwa, P.O. Box 699, Nizwa, 611, Oman; Taylor, G., School of Accounting, Curtin Business School, Curtin University, GPO Box U1987, Perth, 6845, Australia; Richardson, G., School of Accounting and Finance, The Business School, The University of Adelaide, 10 Pulteney Street, Adelaide, 5005, Australia","This study examines whether a firm’s life cycle explains its propensity to engage in corporate tax avoidance. Based on the Dickinson (2011) model of firm life cycle stages and a large dataset of US publicly listed firms over the 1987–2013 period, we find that tax avoidance is significantly positively associated with the introduction and decline stages and significantly negatively associated with the growth and mature stages using the shake-out stage as a benchmark. We observe a U-shaped pattern in tax avoidance outcomes across the various life cycle stages in line with the predictions of dynamic resource-based theory. Our findings are consistent using several robustness checks. Overall, our results show that a firm’s life cycle stage is a significant determinant of tax avoidance. © 2016 European Accounting Association.",,,"Richardson, G.; School of Accounting and Finance, 10 Pulteney Street, Australia; email: grant.richardson@adelaide.edu.au",,"Routledge",09638180,,,,"English","Eur. Acc. Rev.",Article,"Final","All Open Access, Green",Scopus,2-s2.0-84976287687
"Diller M., Kortebusch P., Schneider G., Sureth-Sloane C.","57189364127;57189372756;55057824100;6507559294;","Boon or Bane? Advance Tax Rulings as a Measure to Mitigate Tax Uncertainty and Foster Investment",2017,"European Accounting Review","26","3",,"441","468",,3,"10.1080/09638180.2016.1169939","https://www.scopus.com/inward/record.uri?eid=2-s2.0-84969793638&doi=10.1080%2f09638180.2016.1169939&partnerID=40&md5=627b1b396a0e6b962e84eb15d64f7ed0","Department of Accounting, Finance and Taxation, University of Passau, Passau, Germany; Department of Taxation, Accounting and Finance, University of Paderborn, Paderborn, Germany; Institute of Accounting and Reporting, University of Graz, Graz, Austria; Vienna University of Economics and Business, Vienna, Austria","Diller, M., Department of Accounting, Finance and Taxation, University of Passau, Passau, Germany; Kortebusch, P., Department of Taxation, Accounting and Finance, University of Paderborn, Paderborn, Germany; Schneider, G., Institute of Accounting and Reporting, University of Graz, Graz, Austria; Sureth-Sloane, C., Department of Taxation, Accounting and Finance, University of Paderborn, Paderborn, Germany, Vienna University of Economics and Business, Vienna, Austria","Politicians and tax practitioners often claim that tax uncertainty negatively affects investment. In many countries, firms can request fee-based advance tax rulings (ATRs) to mitigate tax uncertainty. We analyse theoretically the circumstances under which investors request ATRs, how tax authorities should price them and how they can affect investment. We assume that tax authorities integrate investors’ reasoning into their decisions. We find that in special cases the optimal fee tax authorities should charge is prohibitively high, thus firms will refrain from requesting ATRs. However, we find that revenue-maximising tax authorities offer ATRs if the ruling enables them either to significantly reduce their tax audit costs or to increase the probability of detecting ambiguous tax issues. Under certain circumstances, ATRs may effectively foster investment and potentially benefit both the tax authorities and taxpayers. Our results provide new explanations for why taxpayers that face high levels of tax uncertainty often do not request ATRs, even when the fee is rather low. Our results also hold when the tax authority maximises social wealth instead of its revenues. Regulatory changes in ATR requirements might serve as a natural quasi-experiment for an empirical study of our predictions regarding investment decisions. © 2016 European Accounting Association.",,,"Sureth-Sloane, C.; Department of Taxation, Germany; email: caren.sureth@upb.de",,"Routledge",09638180,,,,"English","Eur. Acc. Rev.",Article,"Final","All Open Access, Green",Scopus,2-s2.0-84969793638
"Baginski S.P., Bozzolan S., Marra A., Mazzola P.","6701742210;6507671638;36696667700;24802348400;","Strategy, Valuation, and Forecast Accuracy: Evidence from Italian Strategic Plan Disclosures",2017,"European Accounting Review","26","2",,"341","378",,1,"10.1080/09638180.2016.1152905","https://www.scopus.com/inward/record.uri?eid=2-s2.0-84964063195&doi=10.1080%2f09638180.2016.1152905&partnerID=40&md5=27b64cfe4e37e5a07419fa077e02daa4","Terry College of Business, University of Georgia, Athens, GA  30602-6252, United States; Department of Business and Management, LUISS ‘Guido Carli’, Rome, Italy; Department of Accounting, Università Bocconi, Milan, Italy; Department of Business; Economics and Law, IULM University, Milano, 20143, Italy","Baginski, S.P., Terry College of Business, University of Georgia, Athens, GA  30602-6252, United States; Bozzolan, S., Department of Business and Management, LUISS ‘Guido Carli’, Rome, Italy; Marra, A., Department of Accounting, Università Bocconi, Milan, Italy; Mazzola, P., Department of Business; Economics and Law, IULM University, Milano, 20143, Italy","Using a sample of 264 strategic plan presentations by Milan Stock Exchange firms during 2001–2012, we present evidence of both a security price reaction and an increase in the accuracy of analysts’ earnings forecasts pursuant to plan disclosure. In the cross-section, the information content of the plan disclosures and the accuracy increase are incrementally associated with the extent of forward-looking narrative disclosures in the plan, after controlling for other disclosures within and outside the plan presentation and the fact that the firm has self-selected into the sample. Both quantitative and qualitative narrative disclosures are informative to investors and analysts. The results are driven by narrative disclosures about company strategy and action plans rather than about the business environment in which the company operates. Our study informs the current debate on the use of voluntary comprehensive, integrated, long-run-oriented strategic plan disclosure as a potential complement for disclosures such as quarterly earnings forecasts that have been described as an example of ‘short-termism’. © 2016 European Accounting Association.",,,"Baginski, S.P.; Terry College of Business, United States; email: baginski@terry.uga.edu",,"Routledge",09638180,,,,"English","Eur. Acc. Rev.",Article,"Final","",Scopus,2-s2.0-84964063195
"Lesage C., Ratzinger-Sakel N.V.S., Kettunen J.","35956578800;55901482900;57189507539;","Consequences of the Abandonment of Mandatory Joint Audit: An Empirical Study of Audit Costs and Audit Quality Effects",2017,"European Accounting Review","26","2",,"311","339",,17,"10.1080/09638180.2016.1152558","https://www.scopus.com/inward/record.uri?eid=2-s2.0-84963542779&doi=10.1080%2f09638180.2016.1152558&partnerID=40&md5=091bf2cdd625ff4b7151b34bf49eebeb","Jouy-en-Josas, Hec Paris, Paris, France; Institute of Auditing and Accounting, University of Hamburg, Hamburg, Germany; Management Accounting Research Group, University of Jyväskylä, Jyväskylän yliopisto, Finland","Lesage, C., Jouy-en-Josas, Hec Paris, Paris, France; Ratzinger-Sakel, N.V.S., Institute of Auditing and Accounting, University of Hamburg, Hamburg, Germany; Kettunen, J., Management Accounting Research Group, University of Jyväskylä, Jyväskylän yliopisto, Finland","This paper focuses on the unique Danish setting in examining the consequences of abandoning a mandatory joint audit regime. We study the effects on audit costs (measured by audit fees) and audit quality (measured by abnormal accruals) of the abandonment of the mandatory joint audit in Denmark in 2005. We perform our analysis on non-financial listed Danish companies for the 2002–2010 period. Our results show that a joint audit is associated with higher fees, but that the association between joint audit and abnormal accruals is insignificant. This suggests that the higher audit fees cannot be explained by higher audit quality. Our results are robust to alternative measurements of fees and audit quality. Additional analyses show that the fee premium related to a joint audit decreases over time and that the Big 4 concentration in our sample has increased since the switch from mandatory to voluntary joint audit. Our results are consistent with the motivations driving the regulatory change in Denmark and are of interest to regulators and actors in the audit market. © 2016 European Accounting Association.",,,"Lesage, C.; Jouy-en-Josas, France; email: lesage@hec.fr",,"Routledge",09638180,,,,"English","Eur. Acc. Rev.",Article,"Final","",Scopus,2-s2.0-84963542779
"Bigus J., Hillebrand C.","8687325400;57188805903;","Bank Relationships and Private Firms’ Financial Reporting Quality",2017,"European Accounting Review","26","2",,"379","409",,10,"10.1080/09638180.2016.1152906","https://www.scopus.com/inward/record.uri?eid=2-s2.0-84963512479&doi=10.1080%2f09638180.2016.1152906&partnerID=40&md5=f75be10bddc38199c44bf7e709aabf6a","Department of Finance & Accounting, Freie Universität Berlin, Berlin, Germany","Bigus, J., Department of Finance & Accounting, Freie Universität Berlin, Berlin, Germany; Hillebrand, C., Department of Finance & Accounting, Freie Universität Berlin, Berlin, Germany","Private firms with relatively high (proprietary) costs of disclosure may benefit from a close relationship with a bank. Relationship lending is based on intertemporal contracting that assumes that the bank is able to acquire private information about the firm and, moreover, to keep this information private. For both reasons, we expect and find that private firms with fewer bank relationships exhibit lower levels of financial reporting quality. Controlling for many other factors, firms with a single bank relationship disclose their financial reports about 14 days later. The size of such firms’ financial reports is also smaller, containing approximately 8% fewer words than the median report. Firms with a single bank relationship also exhibit more earnings management, exceeding the median value of the three-year sum of absolute discretionary accruals by about 20%. The results are robust to different econometric specifications, including endogeneity concerns. They indicate that private firms choose to be opaque in the presence of fewer lending relationships. © 2016 European Accounting Association.",,,"Bigus, J.; Freie Universität Berlin, Garystraße 21, Germany; email: jochen.bigus@fu-berlin.de",,"Routledge",09638180,,,,"English","Eur. Acc. Rev.",Article,"Final","",Scopus,2-s2.0-84963512479
"Sikalidis A., Leventis S.","57188699039;8446820900;","The Impact of Unrealized Fair Value Adjustments on Dividend Policy",2017,"European Accounting Review","26","2",,"283","310",,5,"10.1080/09638180.2016.1146153","https://www.scopus.com/inward/record.uri?eid=2-s2.0-84962450090&doi=10.1080%2f09638180.2016.1146153&partnerID=40&md5=350ee6e566f8e918f034b735da03087b","School of Economics and Business Administration, International Hellenic University, Thessaloniki, Greece; Amsterdam Business School, Accounting Section, Amsterdam, Netherlands; Aston Business School, Finance & Accounting Research Group, Birmingham, United Kingdom","Sikalidis, A., School of Economics and Business Administration, International Hellenic University, Thessaloniki, Greece, Amsterdam Business School, Accounting Section, Amsterdam, Netherlands; Leventis, S., School of Economics and Business Administration, International Hellenic University, Thessaloniki, Greece, Aston Business School, Finance & Accounting Research Group, Birmingham, United Kingdom","We examine the impact of unrealized fair value adjustments on dividend policy. Dividend payouts should include only persistent income [Lintner, J. (1956). Distribution of incomes of corporations among dividends, retained earnings and taxes. American Economic Review, 46(2), 97–113]. In our institutional setting, however, regulators recommend the non-distribution of any income from fair value adjustments, which suggests that they interpret them as transitory. We empirically demonstrate that fair value adjustments on investment property are persistent, while those on financial securities are transitory. We further show that only fair value adjustments from investment properties are distributed. We argue that managers perceive the persistence of the two fair value components correctly, and by doing so, they distribute income consistent with the Lintner framework rather than on regulatory recommendations. Finally, by focusing on managerial optimism, debt contracting, and insider ownership, we demonstrate the conditions under which firms choose to deviate from regulator recommendations and to distribute fair value profits. © 2016 The Author(s). Published by Informa UK Limited, trading as Taylor & Francis Group.",,,"Sikalidis, A.; School of Economics and Business Administration, 14th klm Thessaloniki-Moudania, Greece; email: a.sikalidis@uva.nl",,"Routledge",09638180,,,,"English","Eur. Acc. Rev.",Article,"Final","All Open Access, Hybrid Gold",Scopus,2-s2.0-84962450090
"Chang C.-W., Chen M.-C., Chen V.Y.S.","56530920200;56134454800;55902027300;","Are Corporate Tax Reductions Real Benefits under Imputation Systems?",2017,"European Accounting Review","26","2",,"215","237",,4,"10.1080/09638180.2016.1145067","https://www.scopus.com/inward/record.uri?eid=2-s2.0-84961212649&doi=10.1080%2f09638180.2016.1145067&partnerID=40&md5=4dbf520a5d2544dfd78567f466da931a","Department of Accounting, Ming Chuan University, Taipei, Taiwan; Department of Accounting, National Chengchi University, Taipei, Taiwan","Chang, C.-W., Department of Accounting, Ming Chuan University, Taipei, Taiwan; Chen, M.-C., Department of Accounting, National Chengchi University, Taipei, Taiwan; Chen, V.Y.S., Department of Accounting, National Chengchi University, Taipei, Taiwan","Imputation systems integrate corporate and shareholder personal income taxes to alleviate double taxation of dividend income. In this study, we empirically examine whether a corporate tax rate reduction under an imputation tax system benefits shareholders. Using Taiwan as a setting, our analyses indicate that decreasing the corporate tax rate is associated with an increase in dividend payout ratio and foreign investment. Moreover, the increase in dividend payout ratio is even greater for firms that have a higher increase in foreign ownership. Additionally, the market reacts positively to an announcement of a tax rate reduction; specifically, positive stock price reactions are stronger for firms that experienced a greater increase in foreign ownership in response to the tax rate reduction, for firms with greater liquidity constraints and more growth opportunities before the tax rate reduction, and for firms with a bigger decrease in effective tax rates after the tax rate reduction. Overall, we provide evidence that a tax rate reduction is associated with economic impacts and that foreign shareholders appear to be the main beneficiaries of a tax rate reduction under an imputation tax system. © 2016 European Accounting Association.",,,"Chen, M.-C.; Department of Accounting, No. 64, Sec. 2, ZhiNan Road, Taiwan; email: mingchin@nccu.edu.tw",,"Routledge",09638180,,,,"English","Eur. Acc. Rev.",Article,"Final","",Scopus,2-s2.0-84961212649
"Yu C.-F.","56410187200;","Interactive Reporting Bias Surrounding CEO Turnover†",2017,"European Accounting Review","26","2",,"239","282",,,"10.1080/09638180.2016.1145068","https://www.scopus.com/inward/record.uri?eid=2-s2.0-84961206224&doi=10.1080%2f09638180.2016.1145068&partnerID=40&md5=ef77f1e05b351ba220c0125af80dbedc","Business School, University of Adelaide, Adelaide, SA, Australia","Yu, C.-F., Business School, University of Adelaide, Adelaide, SA, Australia","This paper analyzes how CEO turnover affects successive CEOs' financial reporting decisions and the capital market price. I show that when an outgoing CEO (O) in period 1 is succeeded by an incoming CEO (N) in period 2, strategic interaction between O and N leads to interlinked earnings reports. Specifically, when the level of earnings reported by O is lower, N's reporting strategy is more likely to feature a downward reporting bias. Furthermore, by a comparison of the two-CEO setting with a setting with no CEO turnover, I show that with CEO turnover, (i) the period 2 earnings report is more sensitive to the private information of the CEO in control and less sensitive to the period 1 earnings report; (ii) the period 1 earnings report is more sensitive to the private information of the CEO in control; and (iii) the equilibrium stock price has the same sensitivities toward the associated risks, but is less sensitive to the periods 1 and 2 earnings reports. These results provide a novel explanation for managerial under-reporting bias based on strategic interaction between successive CEOs and shed light on the role of CEO turnover in earnings management behavior and capital market responses. © 2016 European Accounting Association.",,,"Yu, C.-F.; Business School, 10 Pulteney Street, Australia; email: jeffrey.yu@adelaide.edu.au",,"Routledge",09638180,,,,"English","Eur. Acc. Rev.",Article,"Final","",Scopus,2-s2.0-84961206224
"Yoo C.-Y., Pae J.","54394770200;8575544300;","Do Analysts Strategically Employ Cash Flow Forecast Revisions to Offset Negative Earnings Forecast Revisions?",2017,"European Accounting Review","26","2",,"193","214",,3,"10.1080/09638180.2015.1123102","https://www.scopus.com/inward/record.uri?eid=2-s2.0-84954483269&doi=10.1080%2f09638180.2015.1123102&partnerID=40&md5=f2dbe22c3aa0f17c6855e85a48a07013","KAIST College of Business, Korea Advanced Institute of Science and Technology, Seoul, South Korea; Korea University Business School, Korea University, Seoul, South Korea","Yoo, C.-Y., KAIST College of Business, Korea Advanced Institute of Science and Technology, Seoul, South Korea; Pae, J., Korea University Business School, Korea University, Seoul, South Korea","We investigate whether analysts use cash flow forecasts to reduce the impact of earnings forecast revisions (EFRs) on market participants. In particular, we focus on conflict between an analyst's concurrent cash flow and earnings forecast revisions. We hypothesize and find that analysts are more likely to issue a positive cash flow forecast revision when they issue a negative earnings forecast revision concurrently, but not the opposite, particularly for Fortune 500 firms. Furthermore, our supplementary analyses suggest that (1) some analysts optimistically bias cash flow forecasts when they issue negative earnings forecast revisions; (2) the market pays less attention to the historical accuracy of analyst cash flow forecasts, so analysts have some latitude to present their cash flow forecasts in an optimistic way; and (3) the market reacts mainly to the direction, not the magnitude, of cash flow forecast revisions. Overall, these findings suggest that analysts may strategically use cash flow forecasts in conjunction with earnings forecasts to maintain good management relationships. © 2016 European Accounting Association.",,,"Yoo, C.-Y.; KAIST College of Business, 85 Hoegiro, South Korea; email: cyoo@business.kaist.ac.kr",,"Routledge",09638180,,,,"English","Eur. Acc. Rev.",Article,"Final","",Scopus,2-s2.0-84954483269
"Rautiainen A., Urquía-Grande E., Muñoz-Colomina C.","35220463200;55786873400;56584505100;","Institutional Logics in Police Performance Indicator Development: A Comparative Case Study of Spain and Finland",2017,"European Accounting Review","26","2",,"165","191",,9,"10.1080/09638180.2015.1120412","https://www.scopus.com/inward/record.uri?eid=2-s2.0-84951290447&doi=10.1080%2f09638180.2015.1120412&partnerID=40&md5=f91e8bf2ee71bdeb11656fc9529c3b93","Jyväskylä University School of Business and Economics, University of Jyväskylä, Jyväskylä, Finland; Faculty of Economics and Business, Complutense University Madrid, Madrid, Spain","Rautiainen, A., Jyväskylä University School of Business and Economics, University of Jyväskylä, Jyväskylä, Finland; Urquía-Grande, E., Faculty of Economics and Business, Complutense University Madrid, Madrid, Spain; Muñoz-Colomina, C., Faculty of Economics and Business, Complutense University Madrid, Madrid, Spain","Police performance is not easily measurable and the organization and circumstances of police work vary among European countries. Further, police work is surrounded by multiple pressures to make it both economical and effective. Consequently, there are multiple institutional logics in decision-making which may affect the selection and the use of police key performance indicators (KPIs). The KPI selection and use processes reflect the institutional logics, though KPI use may also sometimes influence the institutional logics of police work. In this study, we analyze the KPIs and institutional logics in police work in Finland and Spain. A comparative case research approach is used in order to highlight the differences in institutional logic emphases and in circumstances. Data from semi-structured interviews, internet reports, project work, and discussions are used. Both similarities and differences in the KPIs and in the institutional logic emphasis are found between the Finnish and Spanish police. Understanding the partly general and partly locally constructed nature of institutional logics may facilitate the development of police work performance measurement. We also suggest ways of coping with multiple institutional logics. For example, risk analyses and selecting KPIs against the current institutional logic may facilitate organizational developments. © 2015 European Accounting Association.",,,"Rautiainen, A.; Jyväskylä University School of Business and Economics, P.O. Box 35, Finland; email: antti.i.rautiainen@jyu.fi",,"Routledge",09638180,,,,"English","Eur. Acc. Rev.",Article,"Final","All Open Access, Green",Scopus,2-s2.0-84951290447
