"Achleitner A.-K., Günther N., Kaserer C., Siciliano G.","6505859227;56173398500;6505908882;56174181700;","Real earnings management and accrual-based earnings management in family firms",2014,"European Accounting Review","23","3",,"431","461",,80,"10.1080/09638180.2014.895620","https://www.scopus.com/inward/record.uri?eid=2-s2.0-84901083915&doi=10.1080%2f09638180.2014.895620&partnerID=40&md5=f1a03d1b1ef4bbbda28568a6d59a52d7","Center for Entrepreneurial and Financial Studies (CEFS), Technische Universität München, Arcisstrasse 21, München, 80333, Germany; Accounting Department, Bocconi University, Via Röntgen 1, Milan, 20136, Italy","Achleitner, A.-K., Center for Entrepreneurial and Financial Studies (CEFS), Technische Universität München, Arcisstrasse 21, München, 80333, Germany; Günther, N., Center for Entrepreneurial and Financial Studies (CEFS), Technische Universität München, Arcisstrasse 21, München, 80333, Germany; Kaserer, C., Center for Entrepreneurial and Financial Studies (CEFS), Technische Universität München, Arcisstrasse 21, München, 80333, Germany; Siciliano, G., Accounting Department, Bocconi University, Via Röntgen 1, Milan, 20136, Italy","We examine the effects of family firms on real earnings management (REM) and accrual-based earnings management (ABEM). Using socioemotional wealth as a theoretical framework and considering the differentimplications ofREMandABEMon family firms’ transgenerational sustainability,we hypothesise and find for a sample of 402German listed family firmsduring 1998–2008 that family firms engage less inREMand exhibitmore earnings-decreasingABEMpolicies as compared to a sample of 436 non-family firms.Wefurther provide evidence that family firms as compared to non-family firms treat REMand ABEM as substitute rather than complementary tools for earnings management. Overall, our findings suggest that family firms use earnings management activities strategically, avoiding those that inhibit the firm’s long-term value (i.e. REM) and engaging in those that help families retain transgenerational control (i.e. ABEM). Paper accepted by Guest Editors of the Special Issue on Accounting and Reporting in Family Firms. © 2014 European Accounting Association",,,"Kaserer, C.; Center for Entrepreneurial and Financial Studies (CEFS), Arcisstrasse 21, Germany",,"Routledge",09638180,,,,"English","Eur. Acc. Rev.",Article,"Final","",Scopus,2-s2.0-84901083915
"Hiller K., Mahlendorf M.D., Weber J.","55991690800;35272784300;57203298366;","Management Accountants’ Occupational Prestige Within the Company: A Social Identity Theory Perspective",2014,"European Accounting Review","23","4",,"671","691",,17,"10.1080/09638180.2013.849204","https://www.scopus.com/inward/record.uri?eid=2-s2.0-84920202977&doi=10.1080%2f09638180.2013.849204&partnerID=40&md5=3ef18445bfb967003a020587f6d39471","WHU – Otto Beisheim School of Management, Institute of Management Accounting and Control, Vallendar, Germany","Hiller, K., WHU – Otto Beisheim School of Management, Institute of Management Accounting and Control, Vallendar, Germany; Mahlendorf, M.D., WHU – Otto Beisheim School of Management, Institute of Management Accounting and Control, Vallendar, Germany; Weber, J., WHU – Otto Beisheim School of Management, Institute of Management Accounting and Control, Vallendar, Germany","Abstract: Professional associations and researchers in management accounting have attempted to increase the prestige of management accountants. Although studies have suggested that occupational prestige is important, the prestige of management accountants within the employing organisation and its consequences are still not fully understood. Building on social identity theory, we investigate the effect of occupational prestige, as perceived by management accountants, on organisational–professional conflict. We suggest that prestige can mitigate conflict because management accountants with high prestige will identify more strongly with their organisation, as they see it as a source of self-esteem and might believe that they are taken more seriously by managers. At the same time, we hypothesise that prestige exerts an indirect conflict-increasing effect via professional identification. This is based on the idea that prestige may cause proud management accountants to start to identify more strongly with their profession and become hard-liners, unwilling to compromise the values associated with their profession in the interest of the firm. Results from a series of three surveys support the indirect conflict-increasing effect. Moreover, the results suggest a direct conflict-reducing effect of perceived prestige. The implications for research and practice are discussed. © 2013, © 2013 European Accounting Association.",,,"Mahlendorf, M.D.; WHU – Otto Beisheim School of Management, Institute of Management Accounting and Control, Burgplatz 2, Germany",,"Routledge",09638180,,,,"English","Eur. Acc. Rev.",Article,"Final","",Scopus,2-s2.0-84920202977
"Wisniewski T.P., Moro A.","17436067400;14014204800;","When EU Leaders Speak, the Markets Listen",2014,"European Accounting Review","23","4",,"519","551",,8,"10.1080/09638180.2014.884931","https://www.scopus.com/inward/record.uri?eid=2-s2.0-84920201342&doi=10.1080%2f09638180.2014.884931&partnerID=40&md5=250ce29a607fb05d32201469a628d2da","School of Management, University of Leicester, Leicester, United Kingdom","Wisniewski, T.P., School of Management, University of Leicester, Leicester, United Kingdom; Moro, A., School of Management, University of Leicester, Leicester, United Kingdom","Abstract: We use content analysis software to examine certain characteristics of communications arising from European Council meetings. These characteristics appear to explain a large proportion of variation in stock returns around the meeting dates. More specifically, stock market investors react favourably when the conclusions and declarations issued by heads of states convey a positive sentiment and demonstrate a stance of moral rectitude. On the other hand, the returns tend to be negative when the communications are obfuscated by an excessive use of abstract words and fixated on regional rather than global issues. © 2014, © 2014 European Accounting Association.",,,"Wisniewski, T.P.; School of Management, University of Leicester, Ken Edwards Building, University Road, United Kingdom",,"Routledge",09638180,,,,"English","Eur. Acc. Rev.",Article,"Final","All Open Access, Green",Scopus,2-s2.0-84920201342
"Gillenkirch R.M., Hendriks A., Welker S.A.","8889409600;55954156600;55954241500;","Effects of Executive Compensation Complexity on Investor Behaviour in an Experimental Stock Market",2014,"European Accounting Review","23","4",,"625","645",,1,"10.1080/09638180.2013.847380","https://www.scopus.com/inward/record.uri?eid=2-s2.0-84920186276&doi=10.1080%2f09638180.2013.847380&partnerID=40&md5=bed3a6e95ec9836e3565ce0fd5a453f8","University of Osnabrück, Osnabrück, Germany; Information Management Department, Wintershall Holding, Kassel, Germany","Gillenkirch, R.M., University of Osnabrück, Osnabrück, Germany; Hendriks, A., University of Osnabrück, Osnabrück, Germany; Welker, S.A., University of Osnabrück, Osnabrück, Germany, Information Management Department, Wintershall Holding, Kassel, Germany","Abstract: This study experimentally investigates whether shareholders correctly anticipate the incentive effects of increasingly complex compensation packages given to managers, and whether potential biases in individual shareholder beliefs carry over to price and volume effects in a stock market. In the experiment, a manager makes a decision about the stochastic dividend process generating the firm's fundamental value, and shareholders make estimations about fundamental value and trade shares in a stock market. The manager's action is either known or hidden and, nested in the hidden-action condition, compensation is either simple or complex. We hypothesise that hidden action gives rise to perceived behavioural uncertainty, and that this uncertainty has valuation relevance in that it affects both individual estimations of fundamental firm value and stock prices. Furthermore, we hypothesise that perceived behavioural uncertainty increases with the complexity of compensation, and that compensation complexity also affects trading volume. We find supporting evidence for our conjectures. Both estimations and market prices are biased when the manager's action is hidden, and biases are stronger when compensation is complex. We further find that trading volume decreases when compensation is complex, even though the heterogeneity of investors' individual beliefs increases. © 2013, © 2013 European Accounting Association.",,,"Gillenkirch, R.M.; University of Osnabrück, Rolandstr. 8, Germany",,"Routledge",09638180,,,,"English","Eur. Acc. Rev.",Article,"Final","",Scopus,2-s2.0-84920186276
"Becker S.D.","55762502000;","When Organisations Deinstitutionalise Control Practices: A Multiple-Case Study of Budget Abandonment",2014,"European Accounting Review","23","4",,"593","623",,21,"10.1080/09638180.2014.899918","https://www.scopus.com/inward/record.uri?eid=2-s2.0-84920175083&doi=10.1080%2f09638180.2014.899918&partnerID=40&md5=dfcc6857001f3c86fc27c9416a88c416","Department of Accounting and Management Control, HEC Paris, 1, rue de la libération, Jouy en Josas Cedex, 78351, France","Becker, S.D., Department of Accounting and Management Control, HEC Paris, 1, rue de la libération, Jouy en Josas Cedex, 78351, France","Abstract: Drawing on a framework of deinstitutionalisation, this study explores the abandonment of budgeting through a multiple-case study of four companies. The findings illustrate how a number of antecedents to deinstitutionalisation acted in each setting and show that abandonment was only achieved through skilful agency by dominant insiders to construct the need and manage for change. In addition, a finding of the study is that two of the four companies reversed the deinstitutionalisation and reintroduced traditional budgeting. This is explained by highlighting the role of remnants of formerly institutionalised practices and by demonstrating the importance of administrative and cultural controls which can support the abandonment of a central accounting control practice in the first place. Overall, this research extends previous studies of deinstitutionalisation by analysing a taken-for-granted practice at the micro-level and by giving a more agentic account of its processes. © 2014, © 2014 European Accounting Association.",,,"Becker, S.D.; Department of Accounting and Management Control, HEC Paris, 1, rue de la libération, France",,"Routledge",09638180,,,,"English","Eur. Acc. Rev.",Article,"Final","",Scopus,2-s2.0-84920175083
"Kim S., Lee C.","55314903500;36682619000;","Implementability of Trading Strategies Based on Accounting Information: Piotroski (2000) Revisited",2014,"European Accounting Review","23","4",,"553","558",,3,"10.1080/09638180.2014.921217","https://www.scopus.com/inward/record.uri?eid=2-s2.0-84920173939&doi=10.1080%2f09638180.2014.921217&partnerID=40&md5=86bdf790f9c9aad88305d8daf704dfd4","Department of Accounting, Goodman School of Business, Brock University, St. Catharines, ON, Canada; Department of Accounting, School of Business Administration, Wayne State University, Detroit, MI, United States","Kim, S., Department of Accounting, Goodman School of Business, Brock University, St. Catharines, ON, Canada; Lee, C., Department of Accounting, School of Business Administration, Wayne State University, Detroit, MI, United States","Abstract: The return accumulation approach used in studies on accounting-related anomalies cannot be replicated in a practical context because the number and identity of individual observations within a portfolio are assigned within a research context before the accounting information of all firms in the portfolio would actually be available in real time. We explore this issue by re-examining the results in Piotroski (2000) [Value investing: the use of historical financial statement information to separate winners from losers, Journal of Accounting Research, 38(supplement), 1−44]. We find that the relationship between Piotroski's fundamental signals and subsequent returns is partly driven by the choice of return accumulation periods. Because the method used in Piotroski is typical of those often employed in the accounting literature, this study suggests that evidence of profitable trading strategies and market inefficiency in the literature is likely to be overstated. © 2014, © 2014 European Accounting Association.",,,"Kim, S.; Department of Accounting, Goodman School of Business, Brock University, 500 Glenridge Ave, Canada",,"Routledge",09638180,,,,"English","Eur. Acc. Rev.",Article,"Final","",Scopus,2-s2.0-84920173939
"Papanastasopoulos G.A.","16241947600;","Accounting Accruals and Stock Returns: Evidence from European Equity Markets",2014,"European Accounting Review","23","4",,"729","768",,16,"10.1080/09638180.2014.882264","https://www.scopus.com/inward/record.uri?eid=2-s2.0-84920170599&doi=10.1080%2f09638180.2014.882264&partnerID=40&md5=984cc6ca060c3af9311ab58aa903315f","Department of Business Administration, University of Piraeus, Piraeus, Greece","Papanastasopoulos, G.A., Department of Business Administration, University of Piraeus, Piraeus, Greece","Abstract: In this paper, I show a generalisation of the negative relation of traditional accruals and percent accruals with future returns in 11 of 16 European countries. Positive abnormal returns from hedge portfolios on both accrual measures summarise the economic significance of this generalisation. The magnitude of returns obtained from traditional accruals is higher than that obtained from percent accruals, contrary to existing evidence from the U.S. capital market. The magnitude of the accrual effect on stock returns based on both accrual measures is stronger in countries with higher individualism, lower uncertainty avoidance, higher equity-market development, higher equity-market liquidity, lower transaction costs, higher analyst coverage, lower analyst optimism, and lower ownership concentration. In markets where minorities have legal protection against expropriation by corporate insiders and where accrual accounting is permitted, the accrual effect based only on percent accruals is positive. Earnings opacity does not appear to exhibit a significant influence. Overall, the evidence suggests that cross-country differences in culture, equity-market setting, analysts' research output, investor protection, and ownership structure play an important role in explaining variation on the magnitude of the accrual anomaly in Europe. © 2014, © 2014 European Accounting Association.",,,"Papanastasopoulos, G.A.; Department of Business Administration, University of Piraeus, 80, Karaoli & Dimitriou Street, Greece",,"Routledge",09638180,,,,"English","Eur. Acc. Rev.",Article,"Final","",Scopus,2-s2.0-84920170599
"Henri J.-F., Boiral O., Roy M.-J.","12243541000;6506613972;7402902312;","The Tracking of Environmental Costs: Motivations and Impacts",2014,"European Accounting Review","23","4",,"647","669",,29,"10.1080/09638180.2013.837400","https://www.scopus.com/inward/record.uri?eid=2-s2.0-84920163575&doi=10.1080%2f09638180.2013.837400&partnerID=40&md5=f7b28a5c35c3823832cdf45453a901a1","School of Accounting, Université Laval, Québec, QC, Canada; Management Department, Université Laval, Québec, QC, Canada","Henri, J.-F., School of Accounting, Université Laval, Québec, QC, Canada; Boiral, O., Management Department, Université Laval, Québec, QC, Canada; Roy, M.-J., Management Department, Université Laval, Québec, QC, Canada","Abstract: Most accounting systems separately capture and accumulate one portion of the overall environmental costs of firms, while the remainder is embedded in other cost pools, such as general overhead costs or administrative costs. Little empirical evidence has been provided to explain the impacts of cost accounting systems that make a larger portion of firms' total environmental costs visible. The aim of this study is to conceptually and empirically examine the relationships among the tracking of environmental costs (TEC) by firms, their environmental motivations, and the impacts in terms of environmental and economic performance. Using survey data from a large sample of manufacturing firms, the results suggest two main conclusions. First, the TEC has an indirect influence on economic performance through environmental performance. Second, this indirect effect is influenced by the environmental motivations of the firm. More specifically, this indirect effect is greater (lesser) for firms whose motivations are predominately business-oriented (sustainability-oriented). © 2013, © 2013 European Accounting Association.",,,"Henri, J.-F.; School of Accounting, Université Laval, Pavillon Palasis-Prince, 2325 rue de la Terrasse, Canada",,"Routledge",09638180,,,,"English","Eur. Acc. Rev.",Article,"Final","All Open Access, Green",Scopus,2-s2.0-84920163575
"Batta G., Sucre Heredia R., Weidenmier M.","36459576000;56160628400;6506460785;","Political Connections and Accounting Quality under High Expropriation Risk",2014,"European Accounting Review","23","4",,"485","517",,16,"10.1080/09638180.2014.906316","https://www.scopus.com/inward/record.uri?eid=2-s2.0-84920148991&doi=10.1080%2f09638180.2014.906316&partnerID=40&md5=b4cb9b0fbe922402377cab85f07bac2e","Robert Day School of Economics & Finance, Claremont McKenna College, 500 E. 9th St, Claremont, CA  91711, United States; Escuela de Estudios Politicos y Administativos, Universidad Central de Venezuela, Caracas, 1053, Venezuela","Batta, G., Robert Day School of Economics & Finance, Claremont McKenna College, 500 E. 9th St, Claremont, CA  91711, United States; Sucre Heredia, R., Escuela de Estudios Politicos y Administativos, Universidad Central de Venezuela, Caracas, 1053, Venezuela; Weidenmier, M., Robert Day School of Economics & Finance, Claremont McKenna College, 500 E. 9th St, Claremont, CA  91711, United States","Abstract: We examine the impact of political connections and accounting quality among Venezuelan industrial firms, which face one of the highest levels of expropriation risk worldwide. Based on prior literature, we expect a negative relationship between expropriation risk and accounting quality as firms manage earnings to avoid ‘benign’ state intervention. We find that politically connected firms have higher accounting quality than non-connected firms, which is consistent with connected firms’ lower risk of expropriation due to connections with high-level government officials or ruling party members. The relationship between accounting quality and political connections appears to be strongly moderated by institutional features like expropriation risk. © 2014, © 2014 European Accounting Association.",,,"Batta, G.; Robert Day School of Economics & Finance, Claremont McKenna College, 500 E. 9th St, United States",,"Routledge",09638180,,,,"English","Eur. Acc. Rev.",Article,"Final","",Scopus,2-s2.0-84920148991
"Lahr H.","55817952500;","An Improved Test for Earnings Management Using Kernel Density Estimation",2014,"European Accounting Review","23","4",,"559","591",,5,"10.1080/09638180.2013.860044","https://www.scopus.com/inward/record.uri?eid=2-s2.0-84920139698&doi=10.1080%2f09638180.2013.860044&partnerID=40&md5=85259bb5dee84150a62117c74b00b6c6","Centre for Business Research, Judge Business School, University of Cambridge, Trumpington Street, Cambridge, CB2 1AG, United Kingdom","Lahr, H., Centre for Business Research, Judge Business School, University of Cambridge, Trumpington Street, Cambridge, CB2 1AG, United Kingdom","Abstract: This paper describes improvements on methods developed by Burgstahler and Dichev (1997, Earnings management to avoid earnings decreases and losses, Journal of Accounting and Economics, 24(1), pp. 99–126) and Bollen and Pool (2009, Do hedge fund managers misreport returns? Evidence from the pooled distribution, Journal of Finance, 64(5), pp. 2257–2288) to test for earnings management by identifying discontinuities in distributions of scaled earnings or earnings forecast errors. While existing methods use preselected bandwidths for kernel density estimation and histogram construction, the proposed test procedure addresses the key problem of bandwidth selection by using a bootstrap test to endogenise the selection step. The main advantage offered by the bootstrap procedure over prior methods is that it provides a reference distribution that cannot be globally distinguished from the empirical distribution rather than assuming a correct reference distribution. This procedure limits the researcher's degrees of freedom and offers a simple procedure to find and test a local discontinuity. I apply the bootstrap density estimation to earnings, earnings changes, and earnings forecast errors in US firms over the period 1976–2010. Significance levels found in earlier studies are greatly reduced, often to insignificant values. Discontinuities cannot be detected in analysts’ forecast errors, while such findings of discontinuities in earlier research can be explained by a simple rounding mechanism. Earnings data show a large drop in loss aversion after 2003 that cannot be detected in changes of earnings. © 2013, © 2013 European Accounting Association.",,,"Lahr, H.; Centre for Business Research, Judge Business School, University of Cambridge, Trumpington Street, United Kingdom",,"Routledge",09638180,,,,"English","Eur. Acc. Rev.",Article,"Final","All Open Access, Green",Scopus,2-s2.0-84920139698
[No author name available],[No author id available],"Correction: Special Issue on ‘Accounting and Reporting in Family Firms’ [European Accounting Review, 23, 3, (2014)]",2014,"European Accounting Review","23","4",,"769","",,,"10.1080/09638180.2014.972640","https://www.scopus.com/inward/record.uri?eid=2-s2.0-84920116503&doi=10.1080%2f09638180.2014.972640&partnerID=40&md5=3dfe79a6f03861cff70342faacdb0a52",,"",[No abstract available],,,,,"Routledge",09638180,,,,"English","Eur. Acc. Rev.",Erratum,"Final","",Scopus,2-s2.0-84920116503
"Liang P.J., Nan L.","7203035257;55746337600;","Endogenous Precision of Performance Measures and Limited Managerial Attention",2014,"European Accounting Review","23","4",,"693","727",,7,"10.1080/09638180.2013.864568","https://www.scopus.com/inward/record.uri?eid=2-s2.0-84904248463&doi=10.1080%2f09638180.2013.864568&partnerID=40&md5=03bae5279796d71c6ce38ad4f85329a1","Tepper School of Business, Carnegie Mellon University, Pittsburgh, PA, United States; China Academy for Financial Research (CAFR), Shanghai Jiao Tong University, Shanghai, China; Krannert School of Management, Purdue University, 100 S. Grant St, West Lafayette, IN  47907, United States","Liang, P.J., Tepper School of Business, Carnegie Mellon University, Pittsburgh, PA, United States, China Academy for Financial Research (CAFR), Shanghai Jiao Tong University, Shanghai, China; Nan, L., Krannert School of Management, Purdue University, 100 S. Grant St, West Lafayette, IN  47907, United States","Abstract: In this paper, we model two drivers that underlie the economic trade-off that shareholders face in designing incentives for optimal effort allocation by managers. The first driver is the presence of a performance-reporting task, by which we mean managers may exert effort to improve the precision of their performance measures. The second is limited managerial attention, where performing one task may have an adverse effect on the cost efficiency of performing another. We show that the subtle interactions of the two drivers may alter the characteristics of incentive provision. First, the interaction may lead to a positive relation between the strength of the incentive and the variance of the performance measures. Second, the interaction may cause an informative performance signal to not be used in equilibrium incentive contracts. In particular, it is possible that the principal will not use a signal whose precision can be improved by the manager in order to discourage the manager from diverting attention to the performance-reporting task. Finally, we apply the model to a project-selection setting and show that, in order to induce the agent to choose higher risk, higher return projects, the principal may need to raise the bonus rate when the choice of project is unobservable. © 2014, © 2014 European Accounting Association.",,,"Liang, P.J.; Tepper School of Business, Carnegie Mellon University, 5000 Forbes Ave, United States",,"Routledge",09638180,,,,"English","Eur. Acc. Rev.",Article,"Final","",Scopus,2-s2.0-84904248463
