"Schiemann F., Sakhel A.","15119342600;57190388852;","Carbon Disclosure, Contextual Factors, and Information Asymmetry: The Case of Physical Risk Reporting",2019,"European Accounting Review","28","4",,"791","818",,3,"10.1080/09638180.2018.1534600","https://www.scopus.com/inward/record.uri?eid=2-s2.0-85055498184&doi=10.1080%2f09638180.2018.1534600&partnerID=40&md5=b77de938f54f7dc6987ce292f117146b","School of Business, Economics and Social Sciences, University of Hamburg, Hamburg, Germany","Schiemann, F., School of Business, Economics and Social Sciences, University of Hamburg, Hamburg, Germany; Sakhel, A., School of Business, Economics and Social Sciences, University of Hamburg, Hamburg, Germany","The paper focusses on the reporting of climate change-related physical risks. Drawing on data from the CDP questionnaire for 717 European companies over three years (2011–2013) we find that information asymmetry is generally smaller when firms report about their physical risks. Furthermore, we find that reporting of a higher exposure to physical risks is associated with lower information asymmetry for firms falling under the regulation of the EU Emissions Trading Scheme, whereas for other firms the direction of the relationship reverses. We can rule out that our results are driven by other climate change-related risk disclosures and by disclosures about opportunities arising from climate change. This study is not only relevant because it attests the materiality of climate change-related physical risks. Moreover, we show how a contextual factor–in this study: whether a company falls under climate change-related regulation–moderates the direction of the relationship between reported information and information asymmetry. © 2018, © 2018 European Accounting Association.","Climate change; Information asymmetry; Physical risks; Voluntary disclosure",,"Schiemann, F.; School of Business, Rentzelstr. 7, Germany; email: frank.schiemann@uni-hamburg.de",,"Routledge",09638180,,,,"English","Eur. Acc. Rev.",Article,"Final","",Scopus,2-s2.0-85055498184
"Picard C.-F., Durocher S., Gendron Y.","56002273400;25222583000;57203075764;","Desingularization and Dequalification: A Foray Into Ranking Production and Utilization Processes",2019,"European Accounting Review","28","4",,"737","765",,7,"10.1080/09638180.2018.1535323","https://www.scopus.com/inward/record.uri?eid=2-s2.0-85055479044&doi=10.1080%2f09638180.2018.1535323&partnerID=40&md5=7199580e9e4b7d637e0e1c6a11990402","Faculté des sciences de l’administration, Université Laval, Québec City, QC, Canada; Telfer School of Management, University of Ottawa, Ottawa, ON, Canada","Picard, C.-F., Faculté des sciences de l’administration, Université Laval, Québec City, QC, Canada; Durocher, S., Telfer School of Management, University of Ottawa, Ottawa, ON, Canada; Gendron, Y., Faculté des sciences de l’administration, Université Laval, Québec City, QC, Canada","Although some authors highlight the benefits of journal rankings, previous research is often highly critical of them, insinuating that they can lead to desingularization of academic journals (i.e. their impoverishment and standardization) and dequalification of researchers (i.e. a weakening of researchers’ ability to evaluate academic research). However, as very few authors have empirically assessed these presumptions, we aim to address this gap in the literature. Based on Lucien Karpik’s notions of singularities, judgment devices, forms of involvement, and emulation and rivalry, we assess whether the processes surrounding the production and use of journal rankings might lead to desingularization and dequalification. Our findings support previous research by highlighting that processes where passivity and heteronomy (i.e. lack of autonomy) prevail are conducive to desingularization, rivalry and dequalification. Our findings, however, introduce some nuances into the debate by underscoring instances where emulation logic is employed instead of mere rivalry logic, and where substantial judgment devices and active involvement are mobilized in the production and use of rankings, thereby somewhat alleviating the spread of desingularization and dequalification. Ultimately, our study raises questions that point to a need for serious collective reflection within the academic community on the processes by which published research is evaluated. © 2018, © 2018 European Accounting Association.","Dequalification; Desingularization; Journal rankings; Karpik; Singularities",,"Picard, C.-F.; Faculté des sciences de l’administration, 2325, rue de la Terrasse, Canada; email: claire-france.picard@fsa.ulaval.ca",,"Routledge",09638180,,,,"English","Eur. Acc. Rev.",Article,"Final","All Open Access, Green",Scopus,2-s2.0-85055479044
"Lev B.","7006690925;","Ending the Accounting-for-Intangibles Status Quo",2019,"European Accounting Review","28","4",,"713","736",,6,"10.1080/09638180.2018.1521614","https://www.scopus.com/inward/record.uri?eid=2-s2.0-85054713140&doi=10.1080%2f09638180.2018.1521614&partnerID=40&md5=2779b845cb5d2f99d077b235ab9fe03d","Stern School of Business, New York University, New York, United States","Lev, B., Stern School of Business, New York University, New York, United States","The surge of corporate intangible investments is the hallmark of developed economies, radically transforming the business models, strategies, and performance of business enterprises. Accounting standard-setters, however, by and large, are oblivious to this world-wide development. I establish in this study that this accounting resistance to change seriously harms investors and the economy-at-large, and accordingly I propose feasible remedial changes to the accounting system to adapt it to economic reality. I discuss implementation issues of the proposed change, and the reasons for the three-decade resistance of accounting standard-setters to change the accounting of intangibles. Finally, in order to facilitate the accounting change, I outline a wide-ranging, policy-oriented research agenda on intangibles and related issues. © 2018, © 2018 European Accounting Association.","Accounting change; Accounting for; Intangibles; Reporting of; Research agenda",,"Lev, B.; Stern School of Business, United States; email: blev@stern.nyu.edu",,"Routledge",09638180,,,,"English","Eur. Acc. Rev.",Article,"Final","",Scopus,2-s2.0-85054713140
"Guo B., Paraskevopoulou E., Santamaría Sánchez L.","56609636500;55155319800;16305384200;","Disentangling the Role of Management Control Systems for Product and Process Innovation in Different Contexts",2019,"European Accounting Review","28","4",,"681","712",,5,"10.1080/09638180.2018.1528168","https://www.scopus.com/inward/record.uri?eid=2-s2.0-85054329368&doi=10.1080%2f09638180.2018.1528168&partnerID=40&md5=f51d8c94d4714bac47e83dcb9f769302","Department of Business Administration, Universidad Carlos III of Madrid, Madrid, Spain","Guo, B., Department of Business Administration, Universidad Carlos III of Madrid, Madrid, Spain; Paraskevopoulou, E., Department of Business Administration, Universidad Carlos III of Madrid, Madrid, Spain; Santamaría Sánchez, L., Department of Business Administration, Universidad Carlos III of Madrid, Madrid, Spain","This paper studies the relationship between the use of management control systems and different types of innovation (product and process), taking into account innovation contexts (high-tech versus low-tech sectors). We develop and test our hypotheses based on a large sample of Spanish manufacturing firms and find that input controls have a positive association only with process innovation in both innovation contexts. Behavior controls have similar effects on both types of innovation outcomes for high-tech firms, while they have stronger positive associations with process than with product innovation for low-tech firms. Output controls are equally relevant for product and process innovation in both contexts. © 2018, © 2018 European Accounting Association.","Management control systems; Panel data; Process innovation; Product innovation; Sector characteristics",,"Santamaría Sánchez, L.; Department of Business Administration, Calle Madrid 126, Spain; email: lsantama@emp.uc3m.es",,"Routledge",09638180,,,,"English","Eur. Acc. Rev.",Article,"Final","",Scopus,2-s2.0-85054329368
"Saavedra D.","57194189003;","Is Tax Volatility Priced by Lenders in the Syndicated Loan Market?",2019,"European Accounting Review","28","4",,"767","789",,8,"10.1080/09638180.2018.1520641","https://www.scopus.com/inward/record.uri?eid=2-s2.0-85053526456&doi=10.1080%2f09638180.2018.1520641&partnerID=40&md5=e961efaf72338ed432f35fb7a2821bcb","Anderson School of Management, University of California, Los Angeles, CA, United States","Saavedra, D., Anderson School of Management, University of California, Los Angeles, CA, United States","In this study, I consider the effects of tax risk from tax volatility on the pricing of syndicated debt. Tax volatility is an interesting feature in that managers have some discretion over the risks they take with their tax strategies, which, however, are often harder to monitor for outsiders than risks related to other business activities. Framing my predictions based on the theoretical model developed by Merton [1974], I hypothesize and find that tax volatility is incrementally informative to other priced risks suggesting that tax risks per se are relevant to lenders. Moreover, I find that the results are stronger when the loan contract does not include performance pricing provisions or other restrictions, such as capital expenditure covenants, that protect lenders. This evidence adds to knowledge about the real effects of tax risk. © 2018, © 2018 European Accounting Association.","Borrowing costs; Debt contracting; Tax risk; Tax volatility",,"Saavedra, D.; Anderson School of Management, United States; email: daniel.saavedra@anderson.ucla.edu",,"Routledge",09638180,,,,"English","Eur. Acc. Rev.",Article,"Final","",Scopus,2-s2.0-85053526456
"Dellaportas S., Perera L., Gopalan S., Richardson B.","12779125400;8583597200;57196449459;55581154500;","Implications of a Fragile Professional Identity on Role Behavior: An Exploratory Case of an Accountant Fraudster",2019,"European Accounting Review","28","4",,"659","679",,1,"10.1080/09638180.2018.1523018","https://www.scopus.com/inward/record.uri?eid=2-s2.0-85053522667&doi=10.1080%2f09638180.2018.1523018&partnerID=40&md5=fb42bd68197e48202ce2c7a130bd4080","School of Accounting, RMIT University, Melbourne, VIC, Australia; Faculty of Business and Law, Deakin University, Burwood, VIC, Australia; School of Psychology, Counselling and Psychotherapy, Cairnmillar Institute, Hawthorn East, VIC, Australia","Dellaportas, S., School of Accounting, RMIT University, Melbourne, VIC, Australia; Perera, L., Faculty of Business and Law, Deakin University, Burwood, VIC, Australia; Gopalan, S., Faculty of Business and Law, Deakin University, Burwood, VIC, Australia; Richardson, B., School of Psychology, Counselling and Psychotherapy, Cairnmillar Institute, Hawthorn East, VIC, Australia","This study explores identity-related issues ensuing from the behavioral choices of a professional accountant who was convicted for defrauding clients of money entrusted to him. It is grounded in data collected from semi-structured interviews with the offender and his companion (partner in life), supplemented with transcripts derived from court hearings. Our findings suggest that the offender was an accidental fraudster whose crime was committed because of his personal traits and because he abandoned an apparently fragile professional identity for a dominant alternative identity. This led the offender to violate professional norms and self-rationalise illegal activity as both temporary and beneficial to his client. Our data illustrate the perils of the professional accountant identity not being firmly established, maintained or regarded as dominant; it enables behavior inconsistent with the professional ‘accountant’ identity, including criminal activity. This study extends understanding of fraudulent accounting practice by illustrating the role of professional identity in preventing illegal practice in the context of a qualitative forensic case study. It highlights the centrality of professional identity formation, maintenance and reinforcement, particularly in the context of identity conflicts. © 2018, © 2018 European Accounting Association.",,,"Dellaportas, S.; School of Accounting, 445 Swanston St., Australia; email: steven.dellaportas@rmit.edu.au",,"Routledge",09638180,,,,"English","Eur. Acc. Rev.",Article,"Final","",Scopus,2-s2.0-85053522667
"Boone J.P., Khurana I.K., Raman K.K.","7102637305;6701350734;7006329911;","Audit Market Response to PCAOB Censures of US Big 4 Firms",2019,"European Accounting Review","28","4",,"621","658",,1,"10.1080/09638180.2018.1504687","https://www.scopus.com/inward/record.uri?eid=2-s2.0-85052113091&doi=10.1080%2f09638180.2018.1504687&partnerID=40&md5=0021f14ca6c39df7137745a749673fcf","Department of Accounting, College of Business Administration, The University of Texas at San Antonio, San Antonio, TX, United States; School of Accountancy, University of Missouri-Columbia, Columbia, MO, United States","Boone, J.P., Department of Accounting, College of Business Administration, The University of Texas at San Antonio, San Antonio, TX, United States; Khurana, I.K., School of Accountancy, University of Missouri-Columbia, Columbia, MO, United States; Raman, K.K., Department of Accounting, College of Business Administration, The University of Texas at San Antonio, San Antonio, TX, United States","Subsequent to the first-ever Public Company Accounting Oversight Board (PCAOB) censure of a US Big 4 firm (Deloitte) in December 2007, there were two other PCAOB US Big 4 firm censures as of 2016 year-end. We examine whether these two post-2007 PCAOB censures of US Big 4 firms conveyed new information to the audit market. For both censures, we find little or no evidence of any change in the factual audit quality of the censured firm over a three-year window surrounding the censure. Our findings suggest that the quality control deficiencies (identified during inspection of specific audit engagements) that triggered the PCAOB censure were isolated occurrences rather than systemic to the firm at large, i.e., the censures do not imply an impairment in the US Big 4 firm's overall factual audit quality. We also find that the negative response of investors and audit committees documented in prior research for the 2007 Deloitte censure disappeared for the later US Big 4 firm censures. Given that the PCAOB inspects (and can censure) non-US auditors who audit US-listed foreign companies, our findings are of potential interest to regulators, investors and audit committees outside the US. © 2018, © 2018 European Accounting Association.","Audit firm inspections; Censures of US Big 4 firms; PCAOB; US Big 4 audit quality",,"Khurana, I.K.; School of Accountancy, United States; email: khuranai@missouri.edu",,"Routledge",09638180,,,,"English","Eur. Acc. Rev.",Article,"Final","",Scopus,2-s2.0-85052113091
"Marshall B.R., Nguyen N., Visaltanachoti N.","7202280007;36976154300;22136627200;","A Note on Intraday Event Studies",2019,"European Accounting Review","28","3",,"605","619",,,"10.1080/09638180.2018.1530606","https://www.scopus.com/inward/record.uri?eid=2-s2.0-85054525283&doi=10.1080%2f09638180.2018.1530606&partnerID=40&md5=86d9d113798bced415c7bb1888f54568","School of Economics and Finance, Massey University, Palmerston North, New Zealand; Newcastle Business School, University of Newcastle, Newcastle, Australia; School of Economics and Finance, Massey University, Newcastle, New Zealand","Marshall, B.R., School of Economics and Finance, Massey University, Palmerston North, New Zealand, Newcastle Business School, University of Newcastle, Newcastle, Australia; Nguyen, N., School of Economics and Finance, Massey University, Newcastle, New Zealand; Visaltanachoti, N., School of Economics and Finance, Massey University, Newcastle, New Zealand","We investigate the specification and power of intraday event study test statistics. Mean, market, and matched firm models generate well-specified return results for a range of intervals up to 60 min around the event. These models detect return shocks equivalent to one spread in one-minute interval data and three spreads in longer intervals. Researchers using intraday return event studies can, therefore, be confident in their robustness. Some volume event study approaches have reasonable power but they are not generally well specified, while a matched-firm approach gives the best combination of specification and power for spread event studies. © 2018, © 2018 European Accounting Association.","Event study; Intraday; Power test; Specification test",,"Marshall, B.R.; School of Economics and Finance, Private Bag 11-222, New Zealand; email: b.marshall@massey.ac.nz",,"Routledge",09638180,,,,"English","Eur. Acc. Rev.",Article,"Final","",Scopus,2-s2.0-85054525283
"Sellhorn T., Stier C.","14523660900;56736063100;","Fair Value Measurement for Long-Lived Operating Assets: Research Evidence",2019,"European Accounting Review","28","3",,"573","603",,2,"10.1080/09638180.2018.1511816","https://www.scopus.com/inward/record.uri?eid=2-s2.0-85052534993&doi=10.1080%2f09638180.2018.1511816&partnerID=40&md5=58a7f71bb5f31797de6e3576c2551362","Institute for Accounting, Auditing and Analysis, LMU Munich School of Management, Munich, Germany; Porsche AG, Stuttgart, Germany","Sellhorn, T., Institute for Accounting, Auditing and Analysis, LMU Munich School of Management, Munich, Germany; Stier, C., Porsche AG, Stuttgart, Germany","This paper reviews research evidence on the usefulness of fair value measurement of long-lived operating assets for financial reporting. Although economically material, these assets have been sidelined in the current fair value debate that largely centers on financial assets, from which operating assets differ in important respects. Our review provides several insights. First, fair value measurement is pervasive for investment property, while nearly non-existent for PP&E and intangible assets. Second, external fair value appraisers help enhance the decision usefulness of fair values. Third, the determinants of fair-value-related reporting choices vary by context and are not yet well-understood. Fourth, fair value measurement is largely useful when it comes to the valuation role of financial reporting, but this usefulness varies across recognized and disclosed fair values. Fifth, the contracting implications of fair value measurement for long-lived operating assets are severely under-researched. Overall, whereas extant research provides relevant insights, it is derived from diverse settings employing different measures and research designs, and does not yet provide an accumulation of evidence sufficient for final clarity about the determinants and consequences of fair value measurement for long-lived operating assets. Based on this conclusion, we develop several suggestions for future research in this area. © 2018, © 2018 European Accounting Association.","Contracting; Economic consequences; Fair value; Operating assets; Value relevance",,"Sellhorn, T.; Institute for Accounting, Ludwigstraße 28 RG/4. OG, Germany; email: sellhorn@bw.lmu.de",,"Routledge",09638180,,,,"English","Eur. Acc. Rev.",Article,"Final","",Scopus,2-s2.0-85052534993
"Chang W.-C., Choy H.L., Lin H.-Y., Koo M.","57149450400;25647251900;57193552231;55266711100;","The Determinants and Effects of Clients Following Audit Partners Who Switch Audit Firms",2019,"European Accounting Review","28","3",,"541","571",,3,"10.1080/09638180.2018.1509014","https://www.scopus.com/inward/record.uri?eid=2-s2.0-85052311962&doi=10.1080%2f09638180.2018.1509014&partnerID=40&md5=c8047f127120139e359c0a83de3f5c20","Department of Accounting, National Changhua University of Education, Changhua, Taiwan; Department of Accounting and Taxation, Bennett S. LeBow College of Business, Drexel University, Philadelphia, PA, United States; Department of Finance, National Formosa University, Huwei, Taiwan; Accounting Department, College of Business Administration, California State Polytechnic University, Pomona, CA, United States","Chang, W.-C., Department of Accounting, National Changhua University of Education, Changhua, Taiwan; Choy, H.L., Department of Accounting and Taxation, Bennett S. LeBow College of Business, Drexel University, Philadelphia, PA, United States; Lin, H.-Y., Department of Finance, National Formosa University, Huwei, Taiwan; Koo, M., Accounting Department, College of Business Administration, California State Polytechnic University, Pomona, CA, United States","We examine the determinants of clients’ decision to follow departing partners to new audit firms and the effect of this decision on the likelihood of financial restatements. Using Taiwanese audit partner turnover data from 1984 to 2010, we find that clients are more likely to follow departing partners when the partners have more clients, longer tenure, and when both lead and concurring partners leave simultaneously. By contrast, clients are more likely to stay with their incumbent audit firms when the firms are one of the Big Four or when only the concurring partners leave. The extended partner tenure due to clients following departing partners, however, does not enhance audit quality. In fact, clients that stay at the incumbent firm experience a significant decrease in the probability of financial restatements in the first year after the audit partners leave, but clients that follow do not. © 2018, © 2018 European Accounting Association.","Auditor change; Client following; Departing audit partner; Financial restatements",,"Chang, W.-C.; Department of Accounting, 2, Shi-Da Road, Bao-Shan Campus, China; email: wcchang@cc.ncue.edu.tw",,"Routledge",09638180,,,,"English","Eur. Acc. Rev.",Article,"Final","",Scopus,2-s2.0-85052311962
"Xu H., Dao M., Petkevich A.","57203066970;55008575000;55847152500;","Political Corruption and Auditor Behavior: Evidence from US Firms",2019,"European Accounting Review","28","3",,"513","540",,3,"10.1080/09638180.2018.1499547","https://www.scopus.com/inward/record.uri?eid=2-s2.0-85050381165&doi=10.1080%2f09638180.2018.1499547&partnerID=40&md5=b8e8d6e072098a0f058f602425524daa","Department of Accounting and Finance, The University of Massachusetts Dartmouth, Dartmouth, MA, United States; The Department of Accounting, The University of Toledo, Toledo, OH, United States; Neff Department of Finance, The University of Toledo, Toledo, OH, United States","Xu, H., Department of Accounting and Finance, The University of Massachusetts Dartmouth, Dartmouth, MA, United States; Dao, M., The Department of Accounting, The University of Toledo, Toledo, OH, United States; Petkevich, A., Neff Department of Finance, The University of Toledo, Toledo, OH, United States","This paper investigates the impact of political corruption on auditor behavior in the United States. We find that US firms headquartered in more corrupt regions pay higher audit fees, have longer audit report lags, and are more likely to receive a going concern audit opinion. Political corruption is a manifestation of a weak institutional environment and, as such, weakens the rule of law. In addition, political corruption erodes the public’s belief in a political system and reduces interpersonal trust. Our results suggest that auditors assess the risk and trustworthiness of their clients based on where firms are headquartered. The results are robust to using a 2SLS regression analysis and a propensity-score-matched sample. This study extends the prior research on political corruption and the client risk management strategies used by external auditors. Moreover, the current study will be helpful to regulators considering the more explicit role of external auditors in corruption risk assessment. © 2018, © 2018 European Accounting Association.","Audit fees; Audit report lag; Going concern audit opinion; Political corruption",,"Xu, H.; Department of Accounting and Finance, 285 Old Westport Road, United States; email: hxu5@umassd.edu",,"Routledge",09638180,,,,"English","Eur. Acc. Rev.",Article,"Final","",Scopus,2-s2.0-85050381165
